{
  "name": "full-security-review",
  "version": "1.5.0",
  "description": "Structured security audit covering injection, auth, secrets, input validation, dependencies, cryptography, and AI/LLM risks. Produces severity-graded findings.",
  "author": {
    "name": "Doug Eubanks",
    "github": "realdougeubanks"
  },
  "license": "MIT",
  "category": "security",
  "tags": [
    "security",
    "audit",
    "review",
    "owasp",
    "vulnerability",
    "injection"
  ],
  "commands": [
    "/full-security-review"
  ],
  "triggers": [],
  "tools": [
    "Read",
    "Glob",
    "Grep",
    "Write",
    "Bash"
  ]
}
