{
  "name": "doc-refresh",
  "version": "1.4.1",
  "description": "Documentation refresh: audits stale docs, creates missing ones, and rewrites them to a selected standard (STE-lite, plain language, Diataxis) with mandatory security callouts.",
  "author": {
    "name": "Doug Eubanks",
    "github": "realdougeubanks"
  },
  "license": "MIT",
  "category": "productivity",
  "tags": [
    "documentation",
    "docs",
    "refresh",
    "on-call",
    "runbook",
    "security",
    "stale",
    "audit"
  ],
  "commands": [
    "/doc-refresh"
  ],
  "triggers": [],
  "tools": [
    "Read",
    "Write",
    "Edit",
    "Glob",
    "Grep",
    "Bash"
  ]
}
