{
  "name": "dependency-audit",
  "version": "1.4.0",
  "description": "Audits dependencies across npm, pip, Go, Cargo, Composer, .NET, and Ruby manifests for unpinned versions, deprecated packages, missing lockfiles, and known CVEs.",
  "author": {
    "name": "Doug Eubanks",
    "github": "realdougeubanks"
  },
  "license": "MIT",
  "category": "security",
  "tags": [
    "dependencies",
    "audit",
    "security",
    "cve",
    "npm",
    "pip",
    "go",
    "ruby"
  ],
  "commands": [
    "/dependency-audit"
  ],
  "triggers": [],
  "tools": [
    "Read",
    "Glob",
    "Bash",
    "Write"
  ]
}
