{
  "name": "architecture-review",
  "version": "1.3.1",
  "description": "Audits existing architecture for anti-patterns, scalability and reliability risks, and testability gaps. Graded findings with migration paths and a to-be diagram.",
  "author": {
    "name": "Doug Eubanks",
    "github": "realdougeubanks"
  },
  "license": "MIT",
  "category": "standards",
  "tags": [
    "architecture",
    "review",
    "anti-patterns",
    "scalability",
    "reliability",
    "refactoring",
    "technical-debt"
  ],
  "commands": [
    "/architecture-review"
  ],
  "triggers": [],
  "tools": [
    "Read",
    "Glob",
    "Grep",
    "Write",
    "Bash"
  ]
}
