{
  "name": "code-review",
  "version": "1.3.1",
  "description": "Structured engineering code review covering readability, complexity, test gaps, SOLID principles, and API consistency. Complements full-security-review with general code quality.",
  "author": {
    "name": "Doug Eubanks",
    "github": "realdougeubanks"
  },
  "license": "MIT",
  "category": "standards",
  "tags": [
    "code-review",
    "quality",
    "refactoring",
    "solid",
    "complexity",
    "standards"
  ],
  "commands": [
    "/code-review"
  ],
  "triggers": [],
  "tools": [
    "Bash",
    "Read",
    "Glob",
    "Grep",
    "Write"
  ]
}
