{
  "name": "golden-rules",
  "version": "1.9.1",
  "description": "Installs mandatory security, coding, naming, design, testing, error handling, API contract, and performance standards into CLAUDE.md as always-on context for every Claude Code session.",
  "author": {
    "name": "Doug Eubanks",
    "github": "realdougeubanks"
  },
  "license": "MIT",
  "category": "base",
  "tags": [
    "base",
    "security",
    "standards",
    "always-on",
    "testing",
    "error-handling",
    "api-contracts",
    "performance"
  ],
  "commands": [
    "/golden-rules"
  ],
  "triggers": [
    "always"
  ],
  "tools": [
    "Read",
    "Write",
    "Edit",
    "Grep"
  ]
}
