{
  "name": "accessibility",
  "version": "1.4.1",
  "description": "Audits code for WCAG 2.2 AA compliance and provides design guidance for accessible components. Covers semantic HTML, ARIA, keyboard nav, contrast, focus management, and motion.",
  "author": {
    "name": "Doug Eubanks",
    "github": "realdougeubanks"
  },
  "license": "MIT",
  "category": "standards",
  "tags": [
    "accessibility",
    "wcag",
    "a11y",
    "aria",
    "screen-reader",
    "keyboard",
    "inclusive-design"
  ],
  "commands": [
    "/accessibility"
  ],
  "triggers": [],
  "tools": [
    "Read",
    "Glob",
    "Grep"
  ]
}
