{
  "name": "ledger-tasks-yylo",
  "version": "1.0.0",
  "description": "Comprehensive guide for the YYLO Ledger kanban CLI - task create, list, search, deps, ready, order, and merge commands, dependency management, and workflow patterns for agent-driven development.",
  "author": {
    "name": "YYLO team",
    "github": "yylo-dev",
    "url": "https://github.com/yylo-dev/yylo-skills"
  },
  "license": "MIT",
  "category": "workflow",
  "tags": [
    "kanban",
    "task-management",
    "project-management",
    "cli",
    "developer-productivity",
    "agents"
  ],
  "commands": [
    "/ledger-tasks-yylo"
  ],
  "triggers": [],
  "tools": [
    "Bash",
    "Read",
    "Grep",
    "Glob"
  ]
}
