{
  "name": "mvp-readiness",
  "version": "1.4.2",
  "description": "Runs a structured MVP quality-gate audit covering stability, security, logging, docs, and implementation integrity. Reports pass/fail with evidence.",
  "author": {
    "name": "Doug Eubanks",
    "github": "realdougeubanks"
  },
  "license": "MIT",
  "category": "standards",
  "tags": [
    "quality",
    "mvp",
    "audit",
    "checklist",
    "standards"
  ],
  "commands": [
    "/mvp-readiness"
  ],
  "triggers": [],
  "tools": [
    "Bash",
    "Read",
    "Glob",
    "Grep"
  ]
}
