{
  "name": "example-skill",
  "version": "1.3.0",
  "description": "A sample skill that greets the user and summarizes the current project",
  "author": {
    "name": "Claude Marketplace",
    "github": "realdougeubanks"
  },
  "license": "MIT",
  "category": "productivity",
  "tags": [
    "example",
    "template"
  ],
  "commands": [
    "/example-skill"
  ],
  "triggers": [],
  "tools": [
    "Read",
    "Glob"
  ]
}
