{
  "name": "adr",
  "version": "1.4.1",
  "description": "Creates and maintains Architecture Decision Records (ADRs) in docs/decisions/ using the MADR 4.0 format. Supports creating, listing, updating, superseding, and searching ADRs.",
  "author": {
    "name": "Doug Eubanks",
    "github": "realdougeubanks"
  },
  "license": "MIT",
  "category": "workflow",
  "tags": [
    "adr",
    "architecture",
    "decisions",
    "documentation",
    "design",
    "knowledge-management"
  ],
  "commands": [
    "/adr"
  ],
  "triggers": [],
  "tools": [
    "Read",
    "Write",
    "Edit",
    "Glob",
    "Grep"
  ]
}
