{
  "name": "api-design",
  "version": "1.4.0",
  "description": "Designs REST, GraphQL, and gRPC APIs (OpenAPI/schema/proto output) and reviews existing APIs for consistency, best practices, and breaking change risks.",
  "author": {
    "name": "Doug Eubanks",
    "github": "realdougeubanks"
  },
  "license": "MIT",
  "category": "workflow",
  "tags": [
    "api",
    "rest",
    "graphql",
    "grpc",
    "openapi",
    "design",
    "review",
    "contracts"
  ],
  "commands": [
    "/api-design"
  ],
  "triggers": [],
  "tools": [
    "Read",
    "Write",
    "Glob",
    "Grep",
    "Bash"
  ]
}
