{
  "name": "incident-report",
  "version": "1.3.2",
  "description": "Generates professional incident reports using customizable templates. Supports outage, security, performance, and data-loss incident types. Extensible via templates/ and rules/.",
  "author": {
    "name": "Doug Eubanks",
    "github": "realdougeubanks"
  },
  "license": "MIT",
  "category": "workflow",
  "tags": [
    "incident",
    "postmortem",
    "report",
    "sla",
    "on-call",
    "reliability",
    "devops",
    "templates"
  ],
  "commands": [
    "/incident-report"
  ],
  "triggers": [],
  "tools": [
    "Read",
    "Write",
    "Glob",
    "Bash"
  ]
}
